{
  "category": "WinPE",
  "catalog": {
    "toolVersion": "1.2.20.0",
    "schemaVersion": "1.0.0.0",
    "dateReleased": "2026-02-11"
  },
  "items": [
    {
      "id": "sp165773",
      "productId": null,
      "productType": null,
      "systemId": null,
      "systemName": null,
      "architecture": "x64",
      "osId": null,
      "osName": "WinPE 10/11",
      "softPaqId": "sp165773",
      "softPaqVersion": "3.20",
      "name": "sp165773",
      "category": "WinPE",
      "dateReleased": "12/17/2025",
      "downloadUrl": "https://ftp.ext.hp.com/pub/softpaq/sp165501-166000/sp165773.exe",
      "releaseNotesUrl": "https://ftp.ext.hp.com/pub/caps-softpaq/cmit/softpaq/WinPE11.html",
      "sizeBytes": null,
      "md5": null,
      "sha256": null,
      "cvaFileUrl": null,
      "hsaCompliant": null,
      "winpeFamily": "WinPE 10/11",
      "version": "3.20"
    },
    {
      "id": "sp64529",
      "productId": null,
      "productType": null,
      "systemId": null,
      "systemName": null,
      "architecture": "x64",
      "osId": null,
      "osName": "WinPE 4",
      "softPaqId": "sp64529",
      "softPaqVersion": "1.01",
      "name": "sp64529",
      "category": "WinPE",
      "dateReleased": "12/04/2013",
      "downloadUrl": "https://ftp.hp.com/pub/softpaq/sp64501-65000/sp64529.exe",
      "releaseNotesUrl": "https://ftp.hp.com/pub/caps-softpaq/cmit/softpaq/WinPE4.html",
      "sizeBytes": null,
      "md5": null,
      "sha256": null,
      "cvaFileUrl": null,
      "hsaCompliant": null,
      "winpeFamily": "WinPE 4",
      "version": "1.01"
    },
    {
      "id": "sp155634",
      "productId": null,
      "productType": null,
      "systemId": null,
      "systemName": null,
      "architecture": "x64",
      "osId": null,
      "osName": "WinPE 10/11",
      "softPaqId": "sp155634",
      "softPaqVersion": "3.00",
      "name": "sp155634",
      "category": "WinPE",
      "dateReleased": "11/12/2024",
      "downloadUrl": "https://ftp.ext.hp.com/pub/softpaq/sp155501-156000/sp155634.exe",
      "releaseNotesUrl": "https://ftp.ext.hp.com/pub/caps-softpaq/cmit/softpaq/WinPE11.html",
      "sizeBytes": null,
      "md5": null,
      "sha256": null,
      "cvaFileUrl": null,
      "hsaCompliant": null,
      "winpeFamily": "WinPE 10/11",
      "version": "3.00"
    },
    {
      "id": "sp71912",
      "productId": null,
      "productType": null,
      "systemId": null,
      "systemName": null,
      "architecture": "x64",
      "osId": null,
      "osName": "WinPE 5",
      "softPaqId": "sp71912",
      "softPaqVersion": "1.03",
      "name": "sp71912",
      "category": "WinPE",
      "dateReleased": "09/14/2015",
      "downloadUrl": "https://ftp.hp.com/pub/softpaq/sp71501-72000/sp71912.exe",
      "releaseNotesUrl": "https://ftp.hp.com/pub/caps-softpaq/cmit/softpaq/WinPE5.html",
      "sizeBytes": null,
      "md5": null,
      "sha256": null,
      "cvaFileUrl": null,
      "hsaCompliant": null,
      "winpeFamily": "WinPE 5",
      "version": "1.03"
    },
    {
      "id": "sp161830",
      "productId": null,
      "productType": null,
      "systemId": null,
      "systemName": null,
      "architecture": "x64",
      "osId": null,
      "osName": "WinPE 10/11",
      "softPaqId": "sp161830",
      "softPaqVersion": "3.10",
      "name": "sp161830",
      "category": "WinPE",
      "dateReleased": "08/22/2025",
      "downloadUrl": "https://ftp.ext.hp.com/pub/softpaq/sp161501-162000/sp161830.exe",
      "releaseNotesUrl": "https://ftp.ext.hp.com/pub/caps-softpaq/cmit/softpaq/WinPE11.html",
      "sizeBytes": null,
      "md5": null,
      "sha256": null,
      "cvaFileUrl": null,
      "hsaCompliant": null,
      "winpeFamily": "WinPE 10/11",
      "version": "3.10"
    },
    {
      "id": "sp87510",
      "productId": null,
      "productType": null,
      "systemId": null,
      "systemName": null,
      "architecture": "x64",
      "osId": null,
      "osName": "WinPE 3",
      "softPaqId": "sp87510",
      "softPaqVersion": "1.07",
      "name": "sp87510",
      "category": "WinPE",
      "dateReleased": "05/30/2018",
      "downloadUrl": "https://ftp.hp.com/pub/softpaq/sp87501-88000/sp87510.exe",
      "releaseNotesUrl": "https://ftp.hp.com/pub/caps-softpaq/cmit/softpaq/WinPE3.html",
      "sizeBytes": null,
      "md5": null,
      "sha256": null,
      "cvaFileUrl": null,
      "hsaCompliant": null,
      "winpeFamily": "WinPE 3",
      "version": "1.07"
    }
  ],
  "source": {
    "uri": "https://ftp.ext.hp.com/pub/caps-softpaq/cmit/HP_WinPE_DriverPack.html",
    "extractedSha256": null,
    "name": "HP WinPE DriverPack Page",
    "extractedFile": null,
    "catalogType": "WinPEHtmlPage",
    "catalogSha256": "7907c0e4755f930cf74f45cc88733c90b3b3b591568fc898e3f95e2e0e34adf6"
  },
  "generatedAtUtc": "2026-02-11T23:19:45Z",
  "itemCount": 6,
  "schemaVersion": 1
}
